{"schemaVersion":2,"contract":"paper-allocation-list","requestId":"request-synthetic","asOf":"2026-10-14T08:00:00+00:00","items":[{"revisionId":"allocation-synthetic","walletId":"wallet-synthetic","instrumentId":"instrument-synthetic","accountingReceiptId":"receipt-synthetic","priorRevisionId":null,"reason":"Assign paper intention","policyVersion":"paper-wallet-fifo-attribution-v1","recordedByUserId":"user-synthetic","knownAtUtc":"2026-10-14T08:00:00+00:00","publicationSequence":5,"needsReconciliation":false,"quantityAttributionComplete":false,"grossAssetId":"asset-usdt-synthetic","unassignedRetainedGraphPortions":[{"role":"entry","lotId":"lot-synthetic","matchId":null,"unassignedQuantity":"0","withheldReason":null}],"allocations":[{"setupId":"setup-synthetic","attemptId":"attempt-synthetic","role":"entry","lotId":"lot-synthetic","matchId":null,"quantity":"1","grossRealizedPnl":null,"grossWithheldReason":null}],"feesTotal":null,"otherCostsTotal":null,"netRealizedPnl":null,"realizedR":null}],"eTag":"\u0022synthetic-allocation-etag\u0022","nextCursor":null,"publicationWatermark":5,"snapshotCursor":"synthetic-allocation-snapshot"}
